Symbol,Alias,Description,Function,Gene_Set,Species,Literature_Name,Literature_Link,KEGG_ID,KEGG_Name,Gene_ID
Itpr3,"Ip; tf; Ip3r3","inositol 1,4,5-triphosphate receptor 3","An age-related decline in IP3R3 expression and NPY signaling underlie age-related homeostatic changes and olfactory dysfunction.",others,"Mus musculus","Effect of IP3R3 and NPY on age-related declines in olfactory stem cell proliferation",10.1016/j.neurobiolaging.2014.11.007,mmu04935,"Growth hormone synthesis, secretion and action",16440
Jak2,Jtk10,"janus kinase 2","AK2 is a tyrosine kinase involved in cytokine receptor signalling. Disruption of JAK2 causes embryonic lethality due to the absence of definitive erythropoiesis.","stem cell exhaustion","Mus musculus","JAK Inhibition Alleviates the Cellular Senescence-Associated Secretory Phenotype and Frailty in Old Age",10.1126/science.1102756,mmu04935,"Growth hormone synthesis, secretion and action",16452
Jun,"c-Jun; Ap-1","jun proto-oncogene","Transcription factor that recognizes and binds to the enhancer heptamer motif 5'-TGA[CG]TCA-3'. Promotes activity of NR5A1 when phosphorylated by HIPK3 leading to increased steroidogenic gene expression upon cAMP signaling pathway stimulation. Involved in activated KRAS-mediated transcriptional activation of USP28 in colorectal cancer (CRC) cells. Binds to the USP28 promoter in colorectal cancer (CRC) cells.","genomic instability","Mus musculus","Increased Constitutive c-Jun N-terminal Kinase Signaling in Mus musculus Lacking Glutathione S-transferase Pi",10.1126/science.1102757,mmu04310,"Wnt signaling pathway",16476
Jund,Ap-1,"jun D proto-oncogene","The protein encoded by this intronless gene is a member of the JUN family, and a functional component of the AP1 transcription factor complex. This protein has been proposed to protect cells from p53-dependent senescence and apoptosis.","cellular senescence","Mus musculus","Deletion of the Activated protein-1 Transcription Factor JunD Induces Oxidative Stress and Accelerates Age-Related Endothelial Dysfunction",10.1126/science.1102758,mmu04010,"MAPK signaling pathway",16478
Kcna3,"Voltage-Gated Potassium Channel Subunit Kv1.3","potassium voltage-gated channel, shaker-related subfamily, member 3","Mediates the voltage-dependent potassium ion permeability of excitable membranes. Assuming opened or closed conformations in response to the voltage difference across the membrane, the protein forms a potassium-selective channel through which potassium ions may pass in accordance with their electrochemical gradient.","altered intercellular communication","Mus musculus","A family of three mouse potassium channel genes with intronless coding regions",10.1126/science.1102759,unknown,Unknown,16491
Kl,Hftc3,klotho,"May have weak glycosidase activity towards glucuronylated steroids. However, it lacks essential active site Glu residues at positions 241 and 874, suggesting it may be inactive as a glycosidase in vivo. May be involved in the regulation of calcium and phosphorus homeostasis by inhibiting the synthesis of active vitamin D. Essential factor for the specific interaction between FGF23 and FGFR1.",others,"Mus musculus","Mutation of the mouse klotho gene leads to a syndrome resembling ageing",10.1126/science.1102760,mmu04211,"Longevity regulating pathway",16591
Kras,"GTPase KRas","kirsten rat sarcoma viral oncogene homolog","Ras proteins bind GDP/GTP and possess intrinsic GTPase activity. Plays an important role in the regulation of cell proliferation. Plays a role in promoting oncogenic events by inducing transcriptional silencing of tumor suppressor genes (TSGs) in colorectal cancer (CRC) cells in a ZNF304-dependent manner.",others,"Mus musculus","Activation of a c-K-ras oncogene by somatic mutation in mouse lymphomas induced by gamma radiation",10.1126/science.1102761,mmu04211,"Longevity regulating pathway",16653
Lck,"Hck-3; Lsk; Lskt","lymphocyte protein tyrosine kinase","Lck leads to development of leptin-induced renal inflammation during aging.","NF-κB related gene","Mus musculus","Novel Role of Lck in Leptin-Induced Inflammation and Implications for Renal Aging",10.14336/AD.2019.0218,mmu04064,"NF-kappa B signaling pathway",16818
Ldha,"Ldh1; Ldhm","lactate dehydrogenase A","LDH-A depletion inhibits the formation of metastases and prolongs survival through changes in mammary tumor microenvironment that modulate the immune response. We attribute these effects to diminished HIF-1a activity, vascularization, necrosis formation and immune suppression in immune competent animals.",others,"Mus musculus","Age related rise in lactate and its correlation with lactate dehydrogenase (LDH) status in post-mitochondrial fractions isolated from different regions of brain in mice",10.1016/j.neuint.2018.04.007,mmu04066,"HIF-1 signaling pathway",16828
Ldhb,"LDH-H; Ldh2","lactate dehydrogenase B","Exercise-induced changes in tumour LDH-B and MCT1 expression are modulated by oestrogen-related receptor alpha in breast cancer-bearing BALB/c mice.",others,"Mus musculus","Age related rise in lactate and its correlation with lactate dehydrogenase (LDH) status in post-mitochondrial fractions isolated from different regions of brain in mice",10.1016/j.neuint.2018.04.007,mmu04066,"HIF-1 signaling pathway",16832
Lep,"Obs; Ob",leptin,"LEP is secreted from adipose tissues and is involved in food intake and energy expenditure. Mice with mutations in the LEP gene are obese.","deregulated nutrient sensing","Mus musculus","Early Onset of Reproductive Function in Normal Female Mice Treated With Leptin",10.1126/science.1102762,mmu04630,"JAK-STAT signaling pathway",16846
Lepr,"Obr; Cd295","leptin receptor","LEPR is the receptor for leptin (LEP) and is involved in?LEP's signal transduction. Deletion of LEPR in neurons of mice results in obesity.","deregulated nutrient sensing","Mus musculus","A Single Nucleotide Polymorphism (SNP) in the Leptin Receptor Is Associated With BMI, Fat Mass and Leptin Levels in Postmenopausal Caucasian Women",10.1126/science.1102763,mmu04630,"JAK-STAT signaling pathway",16847
Lmna,"Lamin A/C-Like 1","lamin A","Lamins are components of the nuclear lamina, a fibrous layer on the nucleoplasmic side of the inner nuclear membrane, which is thought to provide a framework for the nuclear envelope and may also interact with chromatin. Lamin A and C are present in equal amounts in the lamina of mammals. Plays an important role in nuclear assembly, chromatin organization, nuclear membrane and telomere dynamics. Required for normal development of peripheral nervous system and skeletal muscle and for muscle satellite cell proliferation. Required for osteoblastogenesis and bone formation. Also prevents fat infiltration of muscle and bone marrow, helping to maintain the volume and strength of skeletal muscle and bone. Required for cardiac homeostasis. Isoform?C2?may have a role in determining the organization of nuclear and chromosomal structures during spermatogenesis.","genomic instability","Mus musculus","Loss of A-type lamin expression compromises nuclear envelope integrity leading to muscular dystrophy",10.1126/science.1102764,mmu04210,Apoptosis,16905
Lmnb1,"Lmn2; Lmnb","lamin B1","Lamins are components of the nuclear lamina, a fibrous layer on the nucleoplasmic side of the inner nuclear membrane, which is thought to provide a framework for the nuclear envelope and may also interact with chromatin.","cellular senescence","Mus musculus","The Nuclear Lamina Comes of Age",10.1126/science.1102765,mmu04210,Apoptosis,16906
Lrp2,"AI315343; AW536255","low density lipoprotein receptor-related protein 2","Multiligand endocytic receptor. Acts together with CUBN to mediate endocytosis of high-density lipoproteins. Mediates receptor-mediated uptake of polybasic drugs such as aprotinin, aminoglycosides and polymyxin B.","deregulated nutrient sensing","Mus musculus","Decreased Serum 25-Hydroxyvitamin D in Aging Male Mice Is Associated With Reduced Hepatic Cyp2r1 Abundance",10.1126/science.1102766,unknown,Unknown,14725
Malt1,"Pc; Pcasp1; pa","MALT1 paracaspase","MALT1-deficient mice develop atopic-like dermatitis upon aging, which is preceded by Th2 skewing, an increase in serum IgE, and a decrease in Treg frequency and surface expression of the Treg functionality marker CTLA-4.","NF-κB related gene","Mus musculus","MALT1-Deficient Mice Develop Atopic-Like Dermatitis Upon Aging",10.3389/fimmu.2019.02330,mmu04064,"NF-kappa B signaling pathway",240354
Map3k5,"MEK Kinase 5; Mapkkk5","mitogen-activated protein kinase kinase kinase 5","Serine/threonine kinase which acts as an essential component of the MAP kinase signal transduction pathway. Plays an important role in the cascades of cellular responses evoked by changes in the environment. Mediates signaling for determination of cell fate such as differentiation and survival. Plays a crucial role in the apoptosis signal transduction pathway through mitochondria-dependent caspase activation.","cellular senescence","Mus musculus","Targeted Deletion of Apoptosis Signal-Regulating Kinase 1 Attenuates Left Ventricular Remodeling",10.1126/science.1102767,mmu04010,"MAPK signaling pathway",26408
Mapk14,"Prkm14; p38; Mxi2","mitogen-activated protein kinase 14","Also known as p38, MAPK14 is activated in response to cellular stress and it can phosphorylate a number of transcription factors. It is also involved in the production of?IL6, and is an important player in cellular senescence. In-vitro inhibition of p38 enhances the proliferative potential of mice muscle stem cells and restores the age-declined regenerative potential of stem cells populations. In senescent CD8+ T cells its inhibition increases proliferation, telomerase activity, mitochondrial biogenesis, and fitness, in a mTOR-independent manner. Mice without MAPK14 are anaemic due to failed definitive erythropoiesis.","stem cell exhaustion","Mus musculus","p38MAPK Controls Expression of Multiple Cell Cycle Inhibitors and Islet Proliferation With Advancing Age",10.1126/science.1102768,mmu04218,"Cellular senescence",26416
Mapk3,"Erk1; Prkm3","mitogen-activated protein kinase 3","MAPK3 is involved in stress response signalling and maybe in cell cycle control. MAPK3-null mice are viable and fertile but have defective thymocyte maturation.","stem cell exhaustion","Mus musculus","Influence of Aging and Calorie Restriction on MAPKs Activity in Rat Kidney",10.1126/science.1102769,mmu04910,"Insulin signaling pathway",26417
Mapk8,"Jnk; Jnk1; Sapk1","mitogen-activated protein kinase 8","The protein encoded by this gene is a member of the MAP kinase family. MAP kinases act as an integration point for multiple biochemical signals, and are involved in a wide variety of cellular processes such as proliferation, differentiation, transcription regulation and development. This kinase is activated by various cell stimuli, and targets specific transcription factors, and thus mediates immediate-early gene expression in response to cell stimuli. The activation of this kinase by tumor-necrosis factor alpha (TNF-alpha) is found to be required for TNF-alpha induced apoptosis. This kinase is also involved in UV radiation induced apoptosis, which is thought to be related to cytochrom c-mediated cell death pathway. Studies of the mouse counterpart of this gene suggested that this kinase play a key role in T cell proliferation, apoptosis and differentiation.","deregulated nutrient sensing","Mus musculus","JNK Extends Life Span and Limits Growth by Antagonizing Cellular and Organism-Wide Responses to Insulin Signaling",10.1126/science.1102770,mmu04910,"Insulin signaling pathway",26419
Mapk9,"Jnk2; p54a; Sapk","mitogen-activated protein kinase 9","MAP kinases act as an integration point for multiple biochemical signals, and are involved in a wide variety of cellular processes such as proliferation, differentiation, transcription regulation and development. This kinase targets specific transcription factors, and thus mediates immediate-early gene expression in response to various cell stimuli. It is most closely related to MAPK8, both of which are involved in UV radiation induced apoptosis, thought to be related to the cytochrome c-mediated cell death pathway. This gene and MAPK8 are also known as c-Jun N-terminal kinases. This kinase blocks the ubiquitination of tumor suppressor p53, and thus it increases the stability of p53 in nonstressed cells. Studies of this gene's mouse counterpart suggest a key role in T-cell differentiation. Several alternatively spliced transcript variants encoding distinct isoforms have been reported.","stem cell exhaustion","Mus musculus","JNK Regulates Lifespan in Caenorhabditis Elegans by Modulating Nuclear Translocation of Forkhead Transcription factor/DAF-16",10.1126/science.1102771,mmu04910,"Insulin signaling pathway",26420
Mapt,"Mtbt1; tau; Ppnd","microtubule-associated protein tau","The MAPT protein appears to promote microtubule assembly and stability. MAPT undergoes complex alternative splicing and its transcripts are differentially expressed in the nervous system depending on neuron type and maturation.","loss of proteostasis","Mus musculus","Role of Tau Protein in Both Physiological and Pathological Conditions",10.1126/science.1102772,mmu04010,"MAPK signaling pathway",17762
Max,"bHLHd4; bHLHd5","max protein","A transcriptional regulator, MAX can act as pro- or anti-apoptotic. Although MAX has not been associated with ageing, it may be a part of its signalling cascade in conjunction with other proteins such as?MXI1.","cellular senescence","Mus musculus","Role of Mxi1 in Ageing Organ Systems and the Regulation of Normal and Neoplastic Growth",10.1126/science.1102773,unknown,Unknown,17187
Mdm2,"Hdm2; Mgc5370","transformed mouse 3T3 cell double minute 2","MDM2 is an oncogene that inhibits?TP53. The MDM2 gene encodes multiple transcripts, many of which are tissue-specific. Disruption of MDM2 in mice resulted in increased?TP53-dependent apoptosis and defects in multiple haematopoietic lineages.","cellular senescence","Mus musculus","mdm2 Is Critical for Inhibition of p53 During Lymphopoiesis and the Response to Ionizing Irradiation",10.1126/science.1102774,mmu04115,"p53 signaling pathway",17246
Med1,"Pbp; Trap220","mediator complex subunit 1","Component of the Mediator complex, a coactivator involved in the regulated transcription of nearly all RNA polymerase II-dependent genes. Mediator functions as a bridge to convey information from gene-specific regulatory proteins to the basal RNA polymerase II transcription machinery. Mediator is recruited to promoters by direct interactions with regulatory proteins and serves as a scaffold for the assembly of a functional preinitiation complex with RNA polymerase II and the general transcription factors.","stem cell exhaustion","Mus musculus","Roles of PPARs in Health and Disease",10.1126/science.1102775,unknown,Unknown,19014
Mif,"Phenylpyruvate Tautomerase","macrophage migration inhibitory factor (glycosylation-inhibiting factor)","Pro-inflammatory cytokine. Involved in the innate immune response to bacterial pathogens. The expression of MIF at sites of inflammation suggests a role as mediator in regulating the function of macrophages in host defense. Counteracts the anti-inflammatory activity of glucocorticoids. Has phenylpyruvate tautomerase and dopachrome tautomerase activity (in vitro), but the physiological substrate is not known. It is not clear whether the tautomerase activity has any physiological relevance, and whether it is important for cytokine activity (By similarity).",others,"Mus musculus","MIF is a pituitary-derived cytokine that potentiates lethal endotoxaemia",10.1126/science.1102776,unknown,Unknown,17319
Mlh1,Coca2,"mutL homolog 1","Heterodimerizes with Pms2 to form MutL alpha, a component of the post-replicative DNA mismatch repair system (MMR). DNA repair is initiated by MutS alpha (Msh2-Msh6) or MutS beta (MSH2-MSH3) binding to a dsDNA mismatch, then MutL alpha is recruited to the heteroduplex. Assembly of the MutL-MutS-heteroduplex ternary complex in presence of RFC and PCNA is sufficient to activate endonuclease activity of Pms2. It introduces single-strand breaks near the mismatch and thus generates new entry points for the exonuclease EXO1 to degrade the strand containing the mismatch. DNA methylation would prevent cleavage and therefore assure that only the newly mutated DNA strand is going to be corrected. MutL alpha (Mlh1-Pms2) interacts physically with the clamp loader subunits of DNA polymerase III, suggesting that it may play a role to recruit the DNA polymerase III to the site of the MMR. Also implicated in DNA damage signaling, a process which induces cell cycle arrest and can lead to apoptosis in case of major DNA damages. Heterodimerizes with Mlh3 to form MutL gamma which plays a role in meiosis.","genomic instability","Mus musculus","Meiotic pachytene arrest in MLH1-deficient mice",10.1126/science.1102777,unknown,Unknown,17350
Mmp10,Mmp-10,"Matrix Metallopeptidase 10","Can degrade fibronectin, gelatins of type I, III, IV, and V; weakly collagens III, IV, and V. Activates procollagenase.","senescence-associated secretory phenotype","Mus musculus","Integrative pathway genomics of lung function and airflow obstruction",10.1093/hmg/ddv378,unknown,Unknown,17384
Mmp12,Hme,"Matrix Metallopeptidase 12","May be involved in tissue injury and remodeling. Has significant elastolytic activity. Can accept large and small amino acids at the P1' site, but has a preference for leucine. Aromatic or hydrophobic residues are preferred at the P1 site, with small hydrophobic residues (preferably alanine) occupying P3.","senescence-associated secretory phenotype","Mus musculus","MMP12 preferentially attenuates axial stiffening of aging arteries",10.1115/1.4043322,unknown,Unknown,17381
Mmp13,"Collagenase 3","Matrix Metallopeptidase 13","Plays a role in the degradation of extracellular matrix proteins including fibrillar collagen, fibronectin, TNC and ACAN. Cleaves triple helical collagens, including type I, type II and type III collagen, but has the highest activity with soluble type II collagen. Can also degrade collagen type IV, type XIV and type X. May also function by activating or degrading key regulatory proteins, such as TGFB1 and CCN2. Plays a role in wound healing, tissue remodeling, cartilage degradation, bone development, bone mineralization and ossification. Required for normal embryonic bone development and ossification. Plays a role in the healing of bone fractures via endochondral ossification. Plays a role in wound healing, probably by a mechanism that involves proteolytic activation of TGFB1 and degradation of CCN2. Plays a role in keratinocyte migration during wound healing. May play a role in cell migration and in tumor cell invasion.","senescence-associated secretory phenotype","Mus musculus","Aging enhances liver fibrotic response in mice through hampering extracellular matrix remodeling",10.18632/aging.101124,mmu04657,"IL-17 signaling pathway",17386
Mmp14,Mt1-Mmp,"Matrix Metallopeptidase 14","Endopeptidase that degrades various components of the extracellular matrix such as collagen. Activates progelatinase A. Essential for pericellular collagenolysis and modeling of skeletal and extraskeletal connective tissues during development (By similarity). May be involved in actin cytoskeleton reorganization by cleaving PTK7 (PubMed:20837484). Acts as a positive regulator of cell growth and migration via activation of MMP15. Involved in the formation of the fibrovascular tissues in association with pro-MMP2 (PubMed:12714657). Cleaves ADGRB1 to release vasculostatin-40 which inhibits angiogenesis (PubMed:22330140).","senescence-associated secretory phenotype","Mus musculus","Lumican-null mice are susceptible to aging and isoproterenol-induced myocardial fibrosis",10.1016/j.bbrc.2016.12.033,mmu04668,"TNF signaling pathway",17387
Mmp2,Tbe-1,"Matrix Metallopeptidase 2","Ubiquitinous metalloproteinase that is involved in diverse functions such as remodeling of the vasculature, angiogenesis, tissue repair, tumor invasion, inflammation, and atherosclerotic plaque rupture. As well as degrading extracellular matrix proteins, can also act on several nonmatrix proteins such as big endothelial 1 and beta-type CGRP promoting vasoconstriction. Also cleaves KISS at a Gly-|-Leu bond. Appears to have a role in myocardial cell death pathways. Contributes to myocardial oxidative stress by regulating the activity of GSK3beta. Cleaves GSK3beta in vitro. Involved in the formation of the fibrovascular tissues in association with MMP14.","senescence-associated secretory phenotype","Mus musculus","Dipeptidyl peptidase-4 inhibition prevents vascular aging in mice under chronic stress: Modulation of oxidative stress and inflammation",10.1016/j.cbi.2019.108842,mmu01522,"Endocrine resistance",17390
Mmp3,Stromelysin-1,"Matrix Metallopeptidase 3","Can degrade fibronectin, laminin, gelatins of type I, III, IV, and V; collagens III, IV, X, and IX, and cartilage proteoglycans. Activates procollagenase.","senescence-associated secretory phenotype","Mus musculus","Photo-protective activity of pogostone against UV-induced skin premature aging in mice",10.1016/j.exger.2016.02.017,mmu04657,"IL-17 signaling pathway",17392
Mmp7,"Pump-1 Protease","Matrix Metallopeptidase 7","Degrades casein, gelatins of types I, III, IV, and V, and fibronectin. Activates procollagenase.","senescence-associated secretory phenotype","Mus musculus","Interleukin-17 promotes prostate cancer via MMP7-induced epithelial-to-mesenchymal transition",10.1038/onc.2016.240,mmu04310,"Wnt signaling pathway",17393
Mmp9,"Clg4; Clg4b; Gel B","matrix metallopeptidase 9","Matrix metalloproteinases (MMPs) oversee cell signaling during the aging process by modulating cytokine, chemokine, growth factor, hormone, and angiogenic factor expression and activity.",others,"Mus musculus","The impact of aging on cardiac extracellular matrix",10.1007/s11357-017-9959-9,mmu04657,"IL-17 signaling pathway",17395
Msra,"Mitochondrial Peptide Methionine Sulfoxide Reductase","methionine sulfoxide reductase A","Has an important function as a repair enzyme for proteins that have been inactivated by oxidation. Catalyzes the reversible oxidation-reduction of methionine sulfoxide in proteins to methionine.",others,"Mus musculus","The transcriptional landscape of the mammalian genome",10.1126/science.1102778,unknown,Unknown,110265
Mtco1,CoxI,"cytochrome c oxidase I, mitochondrial","Component of the cytochrome c oxidase, the last enzyme in the mitochondrial electron transport chain which drives oxidative phosphorylation.","mitochondrial dysfunction","Mus musculus","A quantitative and validated SAGE transcriptome reference for adult mouse heart",10.1126/science.1102779,unknown,Unknown,17708
Mtor,"Raft1; Rapt1; Flj44809","mechanistic target of rapamycin kinase","The MTOR kinase belongs to the target of rapamycin group of enzymes which regulate cellular growth and proliferation. TOR enzymes, homologues of MTOR, have been linked to ageing in lower organisms.","deregulated nutrient sensing","Mus musculus","MTOR Regulates the Pro-Tumorigenic Senescence-Associated Secretory Phenotype by Promoting IL1A Translation",10.1126/science.1102780,mmu04211,"Longevity regulating pathway",56717
Mxd1,Mad,"max dimerization protein 1","MAD binds with MAX to form a sequence-specific DNA-binding protein complex which recognizes the core sequence 5'-CAC[GA]TG-3'. MAD thus antagonizes MYC transcriptional activity by competing for MAX.","cellular senescence","Mus musculus","X-ray Structures of Myc-Max and Mad-Max Recognizing DNA  Molecular Bases of Regulation by Proto-Oncogenic Transcription Factors",10.1126/science.1102781,unknown,Unknown,17119
Mxi1,Bhlhc11,"max interactor 1, dimerization protein","MXI1 thus antagonizes MYC transcriptional activity by competing for MAX.",others,"Mus musculus","Role of Mxi1 in Ageing Organ Systems and the Regulation of Normal and Neoplastic Growth",10.1126/science.1102782,unknown,Unknown,17859
Myc,Bhlhe39,"myelocytomatosis oncogene","Activates the transcription of growth-related genes.","cellular senescence","Mus musculus","Reduced Expression of MYC Increases Longevity and Enhances Healthspan",10.1126/science.1102783,mmu04218,"Cellular senescence",17869
Nbn,Nbs1,nibrin,"Component of the MRE11-RAD50-NBN (MRN complex) which plays a critical role in the cellular response to DNA damage and the maintenance of chromosome integrity. The complex is involved in double-strand break (DSB) repair, DNA recombination, maintenance of telomere integrity, cell cycle checkpoint control and meiosis.","genomic instability","Mus musculus","NBS1 is required for macrophage homeostasis and functional activity in mice",10.1126/science.1102784,mmu04218,"Cellular senescence",27354
Ncor1,"N-CoR1; N-CoR","nuclear receptor co-repressor 1","Part of a complex which promotes histone deacetylation and the formation of repressive chromatin structures which may impede the access of basal transcription factors. Participates in the transcriptional repressor activity produced by BCL6.","cellular senescence","Mus musculus","Ablation of Toll-Like Receptor 4 Attenuates Aging-Induced Myocardial Remodeling and Contractile Dysfunction Through NCoRI-HDAC1-mediated Regulation of Autophagy",10.1126/science.1102785,unknown,Unknown,20185
Ncor2,Smrt,"nuclear receptor co-repressor 2","Transcriptional corepressor. Mediates the transcriptional repression activity of some nuclear receptors by promoting chromatin condensation, thus preventing access of the basal transcription.",others,"Mus musculus","The HDAC3 enzymatic activity regulates skeletal muscle fuel metabolism",10.1126/science.1102786,mmu04330,"Notch signaling pathway",20602
