Symbol,Alias,Description,Function,Gene_Set,Species,Literature_Name,Literature_Link,KEGG_ID,KEGG_Name,Gene_ID
Cisd2,"Nutrient-Deprivation Autophagy Factor-1","CDGSH iron sulfur domain 2","Regulator of autophagy that contributes to antagonize BECN1-mediated cellular autophagy at the endoplasmic reticulum. Participates in the interaction of BCL2 with BECN1 and is required for BCL2-mediated depression of endoplasmic reticulum Ca2+?stores during autophagy. Contributes to BIK-initiated autophagy, while it is not involved in BIK-dependent activation of caspases.",others,"Mus musculus","Cisd2 deficiency drives premature aging and causes mitochondria-mediated defects in mice",10.1126/science.1102640,unknown,Unknown,67006
Clock,"Class E Basic Helix-Loop-Helix Protein 8","circadian locomotor output cycles kaput","Transcriptional activator which forms a core component of the circadian clock. The circadian clock, an internal time-keeping system, regulates various physiological processes through the generation of approximately 24 hour circadian rhythms in gene expression, which are translated into rhythms in metabolism and behavior.",others,"Mus musculus","Regulation of the PAI-1 promoter by circadian clock components: differential activation by BMAL1 and BMAL2",10.1126/science.1102641,unknown,Unknown,12753
Clu,"Sgp-2; Sp-40; Trpm-2",clusterin,"The functions of CLU are still unclear, but it may be involved in apoptosis.?CLU-null mice had 50% less brain injury following neonatal hypoxia-ischemia.","cellular senescence","Mus musculus","Serum Levels of the Senescence Biomarker clusterin/apolipoprotein J Increase Significantly in Diabetes Type II and During Development of Coronary Heart Disease or at Myocardial Infarction",10.1126/science.1102642,unknown,Unknown,12759
Cnr1,Cann6,"cannabinoid receptor 1 (brain)","G-protein coupled receptor for cannabinoids, including endocannabinoids (eCBs), such as N-arachidonoylethanolamide (also called anandamide or AEA) and 2-arachidonoylglycerol (2-AG).","deregulated nutrient sensing","Mus musculus","Determination of the cannabinoid receptors in mouse x rat hybridoma NG108-15 cells and rat GH4C1 cells",10.1126/science.1102643,unknown,Unknown,12801
Coq7,"Clk-1; Cat5","demethyl-Q 7","COQ7's functions are unclear, but it may be a metabolic regulator involved in several metabolic pathways such as the biosynthesis of ubiquinone, in turn an antioxidant involved in mitochondrial respiration.","mitochondrial dysfunction","Mus musculus","Early Mitochondrial Dysfunction in Long-Lived Mclk1+/- Mice",10.1126/science.1102644,unknown,Unknown,12850
Creb1,"Cyclic AMP-Responsive Element-Binding Protein 1","cAMP responsive element binding protein 1","This gene encodes a transcription factor that is a member of the leucine zipper family of DNA binding proteins. This protein binds as a homodimer to the cAMP-responsive element, an octameric palindrome. The protein is phosphorylated by several protein kinases, and induces transcription of genes in response to hormonal stimulation of the cAMP pathway.","genomic instability","Mus musculus","Direct Regulation of CREB Transcriptional Activity by ATM in Response to Genotoxic Stress",10.1126/science.1102645,mmu04211,"Longevity regulating pathway",12912
Creb3,"Transcription Factor LZIP-Alpha","cAMP responsive element binding protein 3","Endoplasmic reticulum (ER)-bound sequence-specific transcription factor that directly binds DNA and activates transcription. Plays a role in the unfolded protein response (UPR), promoting cell survival versus ER stress-induced apoptotic cell death. Also involved in cell proliferation, migration and differentiation, tumor suppression and inflammatory gene expression. Acts as a positive regulator of LKN-1/CCL15-induced chemotaxis signaling of leukocyte cell migration. Associates with chromatin to the HERPUD1 promoter. Also induces transcriptional activation of chemokine receptors. Functions as a negative transcriptional regulator in ligand-induced transcriptional activation of the glucocorticoid receptor NR3C1 by recruiting and activating histone deacetylases (HDAC1, HDAC2 and HDAC6). Also decreases the acetylation level of histone H4. Does not promote the chemotactic activity of leukocyte cells.","loss of proteostasis","Mus musculus","The status, quality, and expansion of the NIH full-length cDNA project: the Mammalian Gene Collection (MGC)",10.1126/science.1102646,mmu04211,"Longevity regulating pathway",12913
Creb3l1,Oasis,"cAMP responsive element binding protein 3-like 1","Transcription factor involved in unfolded protein response (UPR). Binds the DNA consensus sequence 5'-GTGXGCXGC-3'. In the absence of endoplasmic reticulum (ER) stress, inserted into ER membranes, with N-terminal DNA-binding and transcription activation domains oriented toward the cytosolic face of the membrane.","loss of proteostasis","Mus musculus","Life-Course Genome-wide Association Study Meta-analysis of Total Body BMD and Assessment of Age-Specific Effects",10.1126/science.1102647,mmu04211,"Longevity regulating pathway",26427
Creb3l2,"CAMP-Responsive Element-Binding Protein 3-Like Protein 2","cAMP responsive element binding protein 3-like 2","Transcription factor involved in unfolded protein response (UPR). In the absence of endoplasmic reticulum (ER) stress, inserted into ER membranes, with N-terminal DNA-binding and transcription activation domains oriented toward the cytosolic face of the membrane.","loss of proteostasis","Mus musculus","BBF2H7, a novel transmembrane bZIP transcription factor, is a new type of endoplasmic reticulum stress transducer",10.1126/science.1102648,mmu04211,"Longevity regulating pathway",208647
Creb3l3,Crebh,"cAMP responsive element binding protein 3-like 3","Transcription factor that may act during endoplasmic reticulum stress by activating unfolded protein response target genes. Activated in response to cAMP stimulation. Binds to the cAMP response element (CRE). Activates transcription through box-B element. Activates transcription through CRE. Seems to function synergistically with ATF6. In acute inflammatory response, may activate expression of acute phase response (APR) genes. May be involved in growth suppression.","loss of proteostasis","Mus musculus","The liver-enriched transcription factor CREB-H is a growth suppressor protein underexpressed in hepatocellular carcinoma",10.1126/science.1102649,mmu04211,"Longevity regulating pathway",208677
Creb3l4,"CAMP-Responsive Element-Binding Protein 3-Like Protein 4","cAMP responsive element binding protein 3-like 4","Transcriptional activator that may play a role in the unfolded protein response of the testis. Proposed to be involved in spermiogenesis. May be involved in regulating the maturation of sperm head nuclei. Alternatively proposed to be a paternally delivered transcription factor that may function in early zygotic gene activation. Increases the binding of CREM isoform Tau with CRE. The CREM isoform Tau-CREB3L4 heterodimer functions through CRE but not through UPRE and may recruit HIRA to CRE to regulate histone exchange.","loss of proteostasis","Mus musculus","Reduction of spermatogenesis but not fertility in Creb3l4-deficient mice",10.1126/science.1102650,mmu04211,"Longevity regulating pathway",78284
Creb5,"CAMP-Response Element-Binding Protein A","cAMP responsive element binding protein 5","Binds to the cAMP response element and activates transcription.",others,"Mus musculus","Mouse brain organization revealed through direct genome-scale TF expression analysis",10.1126/science.1102651,mmu04211,"Longevity regulating pathway",231991
Crebbp,Cbp,"CREB binding protein","Acetylates histones, giving a specific tag for transcriptional activation. Also acetylates non-histone proteins, like DDX21, FBL, IRF2, MAFG, NCOA3, POLR1E/PAF53 and FOXO1. Binds specifically to phosphorylated CREB and enhances its transcriptional activity toward cAMP-responsive genes.",others,"Mus musculus","CREB-Binding protein acetylates hematopoietic transcription factor GATA-1 at functionally important sites",10.1126/science.1102652,mmu04935,"Growth hormone synthesis, secretion and action",12914
Csf3,"Csf; Csfg","colony stimulating factor 3","Granulocyte/macrophage colony-stimulating factors are cytokines that act in hematopoiesis by controlling the production, differentiation, and function of 2 related white cell populations of the blood, the granulocytes and the monocytes-macrophages.","senescence-associated secretory phenotype","Mus musculus","The Ovarian Transcriptome of Reproductively Aged Multiparous Mice: Candidate Genes for Ovarian Cancer Protection",10.3390/biom10010113,unknown,Unknown,12985
Csnk1e,CKIepsilon,"casein kinase 1, epsilon","Casein kinases are operationally defined by their preferential utilization of acidic proteins such as caseins as substrates. Can phosphorylate a large number of proteins. Participates in Wnt signaling. Phosphorylates DVL1. Central component of the circadian clock. In balance with PP1, determines the circadian period length, through the regulation of the speed and rhythmicity of PER1 and PER2 phosphorylation. Controls PER1 and PER2 nuclear transport and degradation. Inhibits cytokine-induced granuloytic differentiation.","loss of proteostasis","Mus musculus","Nuclear entry of the circadian regulator mPER1 is controlled by mammalian casein kinase I epsilon",10.1126/science.1102653,mmu04310,"Wnt signaling pathway",27373
Ctf1,Ct1,"cardiotrophin 1","Receptor tyrosine kinase which binds promiscuously transmembrane ephrin-B family ligands residing on adjacent cells, leading to contact-dependent bidirectional signaling into neighboring cells. The signaling pathway downstream of the receptor is referred to as forward signaling while the signaling pathway downstream of the ephrin ligand is referred to as reverse signaling. Functions in axon guidance during development. Involved in the guidance of commissural axons, that form a major interhemispheric connection between the 2 temporal lobes of the cerebral cortex. Also involved in guidance of contralateral inner ear efferent growth cones at the midline and of retinal ganglion cell axons to the optic disk.",others,"Mus musculus","Nuk controls pathfinding of commissural axons in the mammalian central nervous system",10.1126/science.1102654,mmu04630,"JAK-STAT signaling pathway",13019
Cxcl1,"Gro1; KC","chemokine (C-X-C motif) ligand 1","Has chemotactic activity for neutrophils. Contributes to neutrophil activation during inflammation. Hematoregulatory chemokine, which, in vitro, suppresses hematopoietic progenitor cell proliferation.","senescence-associated secretory phenotype","Mus musculus","Infiltrating macrophages contribute to age-related neuroinflammation in C57/BL6 mice",10.1016/j.mad.2018.05.003,mmu04064,"NF-kappa B signaling pathway",14825
Cxcl2,"CINC-2a; GROb","chemokine (C-X-C motif) ligand 2","Chemotactic for human polymorphonuclear leukocytes but does not induce chemokinesis or an oxidative burst.","senescence-associated secretory phenotype","Mus musculus","Long-term every-other-day administration of DMAMCL has little effect on aging and age-associated physiological decline in mice",10.18632/aging.101932,mmu04064,"NF-kappa B signaling pathway",20310
Cxcl5,"AMCF, AMCF-II","chemokine (C-X-C motif) ligand 5","May participate in the recruitment of inflammatory cells by injured or infected tissue. GCP-2(1-78) and, more potent, GCP-2(9-78) attract neutrophils and are involved in neutrophil activation.","senescence-associated secretory phenotype","Mus musculus","CXCL5-CXCR2 signaling is a senescence-associated secretory phenotype in preimplantation embryos",10.1111/acel.13240,unknown,Unknown,20311
Cyld,"CDMT; CYLD1; EAC","CYLD lysine 63 deubiquitinase","The tumor suppressor CYLD, similarly to other renowned tumor suppressor genes, protects from premature aging and cancer.","NF-κB related gene","Mus musculus","Premature aging and cancer development in transgenic mice lacking functional CYLD",10.18632/aging.101732,mmu04064,"NF-kappa B signaling pathway",74256
Dbn1,Dos117e,"drebrin 1","DBN1 is thought to be involved in neuronal growth. In a mouse model of Alzheimer's disease, DBN1 levels were found to decline with age.","loss of proteostasis","Mus musculus","Docosahexaenoic Acid Protects From Dendritic Pathology in an Alzheimer's Disease Mouse Model",10.1126/science.1102655,unknown,Unknown,56320
Ddit3,"Chop10; Gadd153; Chop","DNA-damage inducible transcript 3","DDIT3 prevents transcription in response to DNA damage. It also appears to be related to apoptosis.","genomic instability","Mus musculus","Expression of the Pro-Apoptotic Gene gadd153/chop Is Elevated in Liver With Aging and Sensitizes Cells to Oxidant Injury",10.1126/science.1102656,mmu04010,"MAPK signaling pathway",13198
Dgat1,"Diglyceride Acyltransferase","diacylglycerol O-acyltransferase 1","Catalyzes the terminal and only committed step in triacylglycerol synthesis by using diacylglycerol and fatty acyl CoA as substrates. In contrast to DGAT2 it is not essential for survival. May be involved in VLDL (very low density lipoprotein) assembly. In liver, plays a role in esterifying exogenous fatty acids to glycerol.",others,"Mus musculus","Retinol esterification by DGAT1 is essential for retinoid homeostasis in murine skin",10.1126/science.1102657,unknown,Unknown,13350
Dll3,Scdo1,"delta like canonical Notch ligand 3","DLL3 is a member of the Notch pathway involved in development. In mice, Notch signalling, including DLL3, has been linked to regeneration in the liver. DLL3 has also been linked to development and neurogenesis.","stem cell exhaustion","Mus musculus","Novel Mutations in DLL3, a Somitogenesis Gene Encoding a Ligand for the Notch Signalling Pathway, Cause a Consistent Pattern of Abnormal Vertebral Segmentation in Spondylocostal Dysostosis",10.1126/science.1102658,mmu04330,"Notch signaling pathway",13389
E2f1,"Rbp3; Rbbp3","E2F transcription factor 1","An important regulator of the cell cycle, E2F1 may mediate apoptosis in conjunction with?TP53.","genomic instability","Mus musculus","Reverse Expression of Aging-Associated Molecules Through Transfection of miRNAs to Aged Mus musculus",10.1126/science.1102659,mmu04218,"Cellular senescence",13555
Eda2r,"TNFRSF27; Xed; Xedar","ectodysplasin A2 receptor","High glucose increases EDA2R expression in kidney cells and that EDA2R induces podocyte apoptosis and dedifferentiation in high glucose milieu partially through enhanced ROS generation.","NF-κB related gene","Mus musculus","EDA2R mediates podocyte injury in high glucose milieu",10.1016/j.biochi.2020.04.003,mmu04064,"NF-kappa B signaling pathway",245527
Eef1a1,"Ee1a1; Ef1a; Eef1a","eukaryotic translation elongation factor 1 alpha 1","EEF1A1 is involved in the binding of tRNA to ribosomes during protein synthesis.","genomic instability","Mus musculus","Apoptosis Rate Can Be Accelerated or Decelerated by Overexpression or Reduction of the Level of Elongation factor-1 Alpha",10.1126/science.1102660,unknown,Unknown,13627
Eef1e1,"Eukaryotic Translation Elongation Factor 1 Epsilon-1","eukaryotic translation elongation factor 1 epsilon 1","Positive modulator of ATM response to DNA damage.","genomic instability","Mus musculus","The haploinsufficient tumor suppressor p18 upregulates p53 via interactions with ATM/ATR",10.1126/science.1102661,unknown,Unknown,66143
Eef2,Ef-2,"eukaryotic translation elongation factor 2","Catalyzes the GTP-dependent ribosomal translocation step during translation elongation. During this step, the ribosome changes from the pre-translocational (PRE) to the post-translocational (POST) state as the newly formed A-site-bound peptidyl-tRNA and P-site-bound deacylated tRNA move to the P and E sites, respectively. Catalyzes the coordinated movement of the two tRNA molecules, the mRNA and conformational changes in the ribosome.","loss of proteostasis","Mus musculus","Memory Decline and Behavioral Inflexibility in Aged Mice Are Correlated With Dysregulation of Protein Synthesis Capacity",10.1126/science.1102662,unknown,Unknown,13629
Efemp1,Fibulin-3,"epidermal growth factor-containing fibulin-like extracellular matrix protein 1","Binds EGFR, the EGF receptor, inducing EGFR autophosphorylation and the activation of downstream signaling pathways. May play a role in cell adhesion and migration. May function as a negative regulator of chondrocyte differentiation. In the olfactory epithelium, it may regulate glial cell migration, differentiation and the ability of glial cells to support neuronal neurite outgrowth.","altered intercellular communication","Mus musculus","subtractive gene expression screen suggests a role of transcription factor AP-2 alpha in control of proliferation and differentiation",10.1126/science.1102663,unknown,Unknown,216616
Egf,Beta-Urogastrone,"epidermal growth factor","Growth factor that mediates its effects via EGFR, ERBB2 and ERBB4. Required for normal cardiac valve formation and normal heart function. Promotes smooth muscle cell proliferation. May be involved in macrophage-mediated cellular proliferation. It is mitogenic for fibroblasts, but not endothelial cells. It is able to bind EGF receptor/EGFR with higher affinity than EGF itself and is a far more potent mitogen for smooth muscle cells than EGF. Also acts as a diphtheria toxin receptor.","cellular senescence","Mus musculus","Heparin-binding EGF-like growth factor: characterization of rat and mouse cDNA clones, protein domain conservation across species, and transcript expression in tissues",10.1126/science.1102664,mmu04010,"MAPK signaling pathway",13645
Egfr,"Erb-B2 Receptor Tyrosine Kinase 1","epidermal growth factor receptor","Receptor tyrosine kinase binding ligands of the EGF family and activating several signaling cascades to convert extracellular cues into appropriate cellular responses.","cellular senescence","Mus musculus","Promoter region of the murine fibroblast growth factor receptor 2 (bek/KGFR) gene",10.1126/science.1102665,mmu04010,"MAPK signaling pathway",13649
Egr1,"Tis8; G0s30; Ngfi-a","early growth response 1","An important regulator of the cell cycle, EGR1 has been suggested to act upstream of ageing-related genes such as TP53. It also appears to be pro-apoptotic.","cellular senescence","Mus musculus","Age-associated Up-Regulation of EGR1 Promotes Granulosa Cell Apoptosis During Follicle Atresia in Mice Through the NF-κB Pathway",10.1126/science.1102666,mmu04912,"GnRH signaling pathway",13653
Ehmt1,"Histone-Lysine N-Methyltransferase EHMT1","euchromatic histone methyltransferase 1","Histone methyltransferase that specifically mono- and dimethylates 'Lys-9' of histone H3 (H3K9me1 and H3K9me2, respectively) in euchromatin. H3K9me represents a specific tag for epigenetic transcriptional repression by recruiting HP1 proteins to methylated histones. Also weakly methylates 'Lys-27' of histone H3 (H3K27me). Also required for DNA methylation, the histone methyltransferase activity is not required for DNA methylation, suggesting that these 2 activities function independently. Probably targeted to histone H3 by different DNA-binding proteins like E2F6, MGA, MAX and/or DP1. During G0 phase, it probably contributes to silencing of MYC- and E2F-responsive genes, suggesting a role in G0/G1 transition in cell cycle. In addition to the histone methyltransferase activity, also methylates non-histone proteins: mediates dimethylation of 'Lys-373' of p53/TP53.","epigenetic alterations","Mus musculus","Histone methyltransferases G9a and GLP form heteromeric complexes and are both crucial for methylation of euchromatin at H3-K9",10.1126/science.1102667,mmu04211,"Longevity regulating pathway",77683
Ehmt2,"Histone H3-K9 Methyltransferase 3","euchromatic histone lysine N-methyltransferase 2","Histone methyltransferase that specifically mono- and dimethylates 'Lys-9' of histone H3 (H3K9me1 and H3K9me2, respectively) in euchromatin. H3K9me represents a specific tag for epigenetic transcriptional repression by recruiting HP1 proteins to methylated histones. Also mediates monomethylation of 'Lys-56' of histone H3 (H3K56me1) in G1 phase, leading to promote interaction between histone H3 and PCNA and regulating DNA replication. Also weakly methylates 'Lys-27' of histone H3 (H3K27me). Also required for DNA methylation, the histone methyltransferase activity is not required for DNA methylation, suggesting that these 2 activities function independently. Probably targeted to histone H3 by different DNA-binding proteins like E2F6, MGA, MAX and/or DP1. May also methylate histone H1. In addition to the histone methyltransferase activity, also methylates non-histone proteins: mediates dimethylation of 'Lys-373' of p53/TP53. Also methylates CDYL, WIZ, ACIN1, DNMT1, HDAC1, ERCC6, KLF12 and itself.","epigenetic alterations","Mus musculus","G9a histone methyltransferase plays a dominant role in euchromatic histone H3 lysine 9 methylation and is essential for early embryogenesis",10.1126/science.1102668,mmu04211,"Longevity regulating pathway",110147
Eif4e,"EIF-4F 25 KDa Subunit","eukaryotic translation initiation factor 4E","Recognizes and binds the 7-methylguanosine-containing mRNA cap during an early step in the initiation of protein synthesis and facilitates ribosome binding by inducing the unwinding of the mRNAs secondary structures. May play an important role in spermatogenesis through translational regulation of stage-specific mRNAs during germ cell development. Its translation stimulation activity is repressed by binding to the complex CYFIP1-FMR1. Component of the CYFIP1-EIF4E-FMR1 complex which binds to the mRNA cap and mediates translational repression. In the CYFIP1-EIF4E-FMR1 complex this subunit mediates the binding to the mRNA cap.",others,"Mus musculus","The fragile X syndrome protein represses activity-dependent translation through CYFIP1, a new 4E-BP",10.1126/science.1102669,mmu04211,"Longevity regulating pathway",13684
Eif4e1b,"Eukaryotic Translation Initiation Factor 4E Type 1B","eukaryotic translation initiation factor 4E family member 1B","Recognizes and binds the 7-methylguanosine-containing mRNA cap during an early step in the initiation of protein synthesis and facilitates ribosome binding by inducing the unwinding of the mRNAs secondary structures.",others,"Mus musculus","Large-scale gene trapping in C57BL/6N mouse embryonic stem cells",10.1126/science.1102670,mmu04211,"Longevity regulating pathway",218268
Eif4e2,"Eukaryotic Translation Initiation Factor 4E Homologous Protein","eukaryotic translation initiation factor 4E member 2","Recognizes and binds the 7-methylguanosine-containing mRNA cap during an early step in the initiation.",others,"Mus musculus","Characterization of mammalian eIF4E-family members",10.1126/science.1102671,mmu04211,"Longevity regulating pathway",26987
Eif4ebp1,"EIF4E-Binding Protein 1","eukaryotic translation initiation factor 4E binding protein 1","Repressor of translation initiation that regulates EIF4E activity by preventing its assembly into the eIF4F complex: hypophosphorylated form competes with EIF4G1/EIF4G3 and strongly binds to EIF4E, leading to repress translation. In contrast, hyperphosphorylated form dissociates from EIF4E, allowing interaction between EIF4G1/EIF4G3 and EIF4E, leading to initiation of translation.",others,"Mus musculus","Control of PHAS-I by insulin in 3T3-L1 adipocytes  Synthesis, degradation, and phosphorylation by a rapamycin-sensitive and mitogen-activated protein kinase-independent pathway",10.1126/science.1102672,mmu04211,"Longevity regulating pathway",13685
Eif5a2,"Eukaryotic Initiation Factor 5A Isoform 2","eukaryotic translation initiation factor 5A2","mRNA-binding protein involved in translation elongation. Has an important function at the level of mRNA turnover, probably acting downstream of decapping. Involved in actin dynamics and cell cycle progression, mRNA decay and probably in a pathway involved in stress response and maintenance of cell wall integrity. Functions as a regulator of apoptosis. Mediates effects of polyamines on neuronal process extension and survival.","loss of proteostasis","Mus musculus","Overexpression of eIF-5A2 in mice causes accelerated organismal aging by increasing chromosome instability",10.1126/science.1102673,unknown,Unknown,208691
Eln,"Wbs; Ws; Svas",elastin,"ELN is structural protein that may be related to arterial morphogenesis. Mice without ELN die of obstructive arterial disease.","altered intercellular communication","Mus musculus","Multisystem Study of 20 Older Adults With Williams Syndrome",10.1126/science.1102674,unknown,Unknown,13717
Emd,"LEM Domain Containing 5",emerin,"Stabilizes and promotes the formation of a nuclear actin cortical network. Stimulates actin polymerization in vitro by binding and stabilizing the pointed end of growing filaments. Inhibits beta-catenin activity by preventing its accumulation in the nucleus. Acts by influencing the nuclear accumulation of beta-catenin through a CRM1-dependent export pathway.",others,"Mus musculus","Loss of A-type lamin expression compromises nuclear envelope integrity leading to muscular dystrophy",10.1126/science.1102675,unknown,Unknown,13726
Eno1,"Eno; Eno-1","enolase 1, alpha non-neuron","DNA-binding transcription repressor activity, RNA polymerase II-specific.",others,"Mus musculus","Alcohol drinking exacerbates neural and behavioral pathology in the 3xTg-AD mouse model of Alzheimer's disease",10.1016/bs.irn.2019.10.017,mmu04066,"HIF-1 signaling pathway",13806
Eno2,"En;, Eno-2; N; NSE","enolase 2, gamma neuronal","It has phosphopyruvate hydratase activity.",others,"Mus musculus","Alcohol drinking exacerbates neural and behavioral pathology in the 3xTg-AD mouse model of Alzheimer's disease",10.1016/bs.irn.2019.10.017,mmu04066,"HIF-1 signaling pathway",13807
